{
  "scene_contract_version_id": "11111111-2222-4333-8444-555555555555",
  "screenplay_scene_version_id": "66666666-7777-4888-8999-aaaaaaaaaaaa",
  "character_version_ids": ["bbbbbbbb-cccc-4ddd-8eee-ffffffffffff"],
  "relationship_version_ids": [],
  "allowed_paths": ["/dialogue/2"],
  "review_notes": "The requested rewrite would require inventing an undeclared secret; block it."
}
